{
  "match_id": "5b0d3c9a-6f2b-4e6f-9a4a-6a4c1a6a1d20",
  "resume_id": "1a2b3c4d-0000-4000-8000-000000000001",
  "job_description_id": "9f8e7d6c-0000-4000-8000-000000000002",
  "overall_score": 0.78,
  "components": [
    { "name": "skills", "raw_score": 0.62, "weighted_contribution": 0.248 },
    { "name": "experience", "raw_score": 0.85, "weighted_contribution": 0.255 },
    { "name": "education", "raw_score": 0.90, "weighted_contribution": 0.135 },
    { "name": "semantic", "raw_score": 0.80, "weighted_contribution": 0.16 }
  ],
  "weakest_component": "skills",
  "narrative_explanation": "Candidate meets experience and education requirements strongly, but shows a gap in required skill coverage (skills raw score 0.62 vs. others above 0.80). Semantic similarity of the overall narrative to the JD is solid at 0.80.",
  "missing_data_mode": "lenient",
  "metadata": { "schema_version": "1.3.0", "model_version": "semantic-matcher-2.1", "pipeline_version": "2026.08.15" },
  "computed_at": "2026-08-28T09:12:41Z"
}
